2020-10-13 05:11:33,777,NYT: July Is the New January: More Companies Delay Return to the Office,/r/nyc/comments/jaba9x/nyt_july_is_the_new_january_more_companies_delay/,2020-10-13 17:11:12,0,"How about finding the money to rehaul and modernize the subway system? Where did you get me suggesting other forms of transportation? 

But honestly, like climate change, it's too little, too late. The MTA has been a bureaucratic shithole for the last 10+ years and now it's a financial black hole. COVID is the final nail in the coffin.

https://www.amny.com/news/outstanding-debt-for-mta-could-reach-50b-by-2024-dinapoli-report/

http://secondavenuesagas.com/2009/01/05/when-the-mta-had-a-surplus/",/r/nyc/comments/jaba9x/nyt_july_is_the_new_january_more_companies_delay/g8qreky/
2020-10-12 09:09:00,5,"Andrew Cuomo, the King of New York",/r/nyc/comments/j9sl6l/andrew_cuomo_the_king_of_new_york/,2020-10-12 10:00:06,5,"> In the fall of 2018, primary challengers beat six of the eight I.D.C. defectors. After Cuomo trounced the Republican candidate, Marc Molinaro, in the gubernatorial race, he started his third term having to contend for the first time with a truly liberal Democratic majority. Last year, the Legislature had its most progressive session ever: new laws were passed addressing rent control, climate change, bail reform, and driver’s licenses for undocumented immigrants. Cuomo, who has in private conversations expressed concern over the leftward lurch of his party, did his best to ride the wave rather than let it wash over him. Now he drove the left nuts in a new way—with, as a Democratic legislator put it recently, “his proclamation of positions that he’s working hard to sabotage.”
>
> “He’s still doing a good job of keeping the crazies at bay,” a prominent Manhattan Democrat told me. He happened to be the kind of Davos Man constituent who Cuomo feared would abandon the city if he were subjected to a new wealth tax, which many progressives have endorsed.
>
> “Cuomo decided years ago, partly by watching his father, that Democrats can’t govern effectively, that they are a tax-and-spend juggernaut, and that any power they have in the Legislature is bad for him,” Bill Lipton, a former political director of the W.F.P., told me. “The ease and consistency with which he does one thing in practice while arguing in public he’s doing the exact opposite—and saying anyone who suggests he’s doing this is crazy—should worry anybody who believes that executives should be transparent and accountable.”
>
> “These are institutional advocates who by their job can never say, ‘It’s enough,’ ” Cuomo told me. “A sitting governor can never satiate advocates. Otherwise, they’re not advocates, by definition. I can’t. My father couldn’t.” Cuomo and his staff, buoyed by their own internal polling and the results of his two primary challenges, contend that he is actually more popular among Democratic voters who consider themselves to be very liberal than he is among those who are closer to the center. They dismiss the W.F.P. as being representative of no one. “They’re not the left,” one of them said. “They don’t represent anybody. They’re a piece of stationery.”
>
> After winning a third term, Cuomo got to work getting back at the Working Families Party. In each of the past two years, he has sneaked a provision into his budget that would almost triple the number of votes a party would need to secure ongoing state financing. The new threshold would be a high hurdle for the W.F.P. On NY1, Jumaane Williams, the New York City public advocate, called Cuomo’s tactics “Trumpian.” Lipton told reporters that the maneuver was “a power grab.” Cuomo, a master of the “Who, me?” defense, dismissed such talk as “conspiracies.”
>
> In his own party, his detractors often speak of him (almost always without attribution, because they are afraid of him) as a brutal boss, a friendless bully, and a paranoid control freak. “It’s not enough for him to win. Other people have to lose,” one said, having lost. Yet there are often caveats. “And by the way,” another told me, after carpet-bombing my notebook with slurs, “he may go down as, if not the greatest, then the most accomplished governor New York has ever had.”
>
> With the press, Cuomo has a reputation for being both exacting and adept. He makes late-night or early-morning calls to reporters—usually off the record, often genial and confiding, sometimes foulmouthed and scathing—which can seem like a gambit to seduce and cow the cadre of regulars assigned to the statehouse beat. He prefers bending an ear to pressing the flesh; the biggest impediment to any designs on the Presidency is the thought of him having to spend weeks in Iowa. Prior to the pandemic briefings, his press conferences were infrequent, his stagecraft tightly controlled. He has a small and loyal team. He is known to have, as one reporter wrote, “an elephant’s long memory for slights.”
> I first approached Cuomo’s office in the spring about spending some time with him. Various members of his staff took up the request and then let it drop. By midsummer, I’d all but given up. Rich Azzopardi, his senior adviser, laughed at my suggestion that I spend a night in the governor’s mansion. In a pandemic? Then, one day in August, my phone rang: Hold for the Governor. He asked to speak off the record, and did so for more than an hour and a half. There was a strange intimacy to the conversation; his timbre was like a pheromone. It didn’t sound as though he were multitasking or pulling faces with his aides. It wasn’t a man just talking to himself, like Nixon at night. He seemed to have all the time in the world. I found myself laughing out loud at some of the Cuomoisms (“We created the we!”), the rhetorical repetitions and Rumsfeldian logic pretzels. I wondered, as I had before, if he was aware of his own peculiarities. For a New Yorker, shtick can be self.
> A few weeks ago, there was another call, this time on background, with quotes to be used only with his later approval. He explained his rationale. “I did four hundred hours of briefings,” he said. “The people can come up with their own opinions of me. They do and they did. They know me better than you know me. And, by the way, they do. They literally do. You bring baggage. They have no baggage. They know me. They know my kids. They know my mother. They know my dog. They came to their own conclusions about me. They don’t need your opinion.”
> The first time I met Cuomo was in 2014, at Billy Joel’s house in Oyster Bay. I was writing about Joel, and he’d invited me to hang around on a morning when he and Cuomo were going out on Joel’s boat for a photo op having to do with cleaning up the bay. The two are good friends. They share an interest in motorcycles and boats, and a pride in being rough-hewn street-smart outsiders vaulted, by talent and luck, into a world of high-class swells. Cuomo presided at Joel’s fourth wedding and is the godfather to his young daughters.
> The two men were alone in the kitchen, not-eating breakfast. Cuomo had on his in-the-field uniform: khakis, white polo shirt with state insignia, tucked in, windbreaker with insignia. They talked about wives and houses. Out on the bay, on the Argos, Joel’s refitted lobster boat, Joel and Cuomo scooped up some plastic for photographers in smaller boats; then they took turns awkwardly scattering panels of oyster seed into the water, to demonstrate support for the oyster-farming operations in the bay and the clean water that they both enable and require.
> Sometime later, I found myself at Joel’s house, on Independence Day. Cuomo was there. Emboldened by a taste of Billy Joel’s gin, I sat down next to the Governor and began to make an argument against an infrastructure project that he’d been promoting, a bridge or a tunnel across Long Island Sound, from Rye to Syosset—a very long and expensive connector between the mainland and the island, to divert traffic from the metropolitan area, that could devastate the region’s shellfishery, which Cuomo and Joel had celebrated a few years earlier. I began to state the case against the project, and Cuomo interrupted and dismissed the premise that there was any oyster fishery worth considering. “They get, what, five oysters a year?” he said. (I’m quoting from memory.) He held forth, in a playfully caustic tone, about NIMBYism, the future of John F. Kennedy Airport as an e-commerce hub, and the virtues of thinking big, in a world of small-minded people, of whom I was presumably one.
> What thrills Cuomo most, to go by his reputation and the evidence, is building things—the kind of big infrastructure projects that might vex more deferential executives. The Second Avenue subway, a new LaGuardia Airport, an expansion of Pennsylvania Station, a replacement for the Tappan Zee Bridge, which he named for his father. Each summoned up a disregard for bureaucratic niceties which some might find refreshing, and a hands-on obsessiveness that is extremely expensive and, for bureaucrats and other hands, crazy-making. As one of those bureaucrats told me, referring to the Cuomo team, “They will slam a bureaucracy for taking too long but then spend an inordinate amount of money to rush it. He is adept at throwing money at a problem. That is a luxury that the bureaucrats don’t have.”
> Still, the travails of the city’s transit system, and of the finances of the Metropolitan Transportation Authority, have beset him throughout his tenure. In 2017, soon after celebrating the opening of the Second Avenue subway, a costly project that had been delayed for decades, Cuomo was confronted by the so-called Summer of Hell—an epochal rise in delays, overcrowding, derailments, and signal malfunctions brought on by years of underinvestment and neglect. Unsuccessfully trying to deflect some of the blame and the cost onto Mayor de Blasio, Cuomo, who controls the M.T.A., declared a state of emergency and hired Andy Byford, a respected transit expert who had most recently remade Toronto’s subways, to run the system. Acclaim in the press (including this magazine) for “Train Daddy” reportedly irked the Governor. After two years, Byford quit, complaining that Cuomo had undermined him, hounded his staff, and in general made it impossible for him to do his job.",/r/nyc/comments/j9sl6l/andrew_cuomo_the_king_of_new_york/g8lnt85/
2020-10-12 08:18:38,73,Multi-billion dollar Nike kicks popular Bronx sporting goods store to the curb after a half-century,/r/nyc/comments/j9rp05/multibillion_dollar_nike_kicks_popular_bronx/,2020-10-12 17:02:38,1,"Lmao dude, do you not understand how political contribution work?

These are mostly individual contributions that you listed, “Nike” contributed nothing. These are contributions the employees independently made.

Nike’s headquarters is in Oregon. Most people in Oregon are democrats. And not shockingly, most donations are to democrats. This is not some nefarious plot by Nike, this is political engaged people donating because they care about abortion, or climate change, or whatever they care about as an individual. Everyone who donates when Trump wouldn’t disavow white supremacy or a fly flew on Pence’s head, has to list their employer. And some of the people happened to work at Nike. 

I work at a bank - I donated a few $100 to Buttigieg and Biden, my coworker donated  a couple hundred to Sanders (barf). Our CEO is a republican, and I can guarantee you doesn’t support either.

PACs and lobby are a bit different and are to push policy, but politicians aren’t directly getting the money for their campaign.

Please receive a basic understanding of politics and governance and economics and corporations work before you decide to hold such strong, black-and-white opinions.",/r/nyc/comments/j9rp05/multibillion_dollar_nike_kicks_popular_bronx/g8n0kjz/
2020-10-10 22:08:27,9,"DAILY COVID-19 MEGATHREAD - October 11, 2020",/r/nyc/comments/j8ypjb/daily_covid19_megathread_october_11_2020/,2020-10-11 17:07:54,-4,"Congratulations on finding one credentialed person to support your fringe viewpoint. Let me guess, you also believe climate change is unsettled science too",/r/nyc/comments/j8ypjb/daily_covid19_megathread_october_11_2020/g8je274/
2020-10-03 10:00:47,30,"New York, San Francisco Rents Plunge in Work-at-Home Shift",/r/nyc/comments/j4hhln/new_york_san_francisco_rents_plunge_in_workathome/,2020-10-04 09:21:54,1,"> Basically there needs to be rules to protect the integrity of the city. But neighborhoods also shouldn’t be able to so easily restrict building of reasonable projects in their area.

So you’re very concerned with “protecting the integrity of the city” despite completely ignoring the price of housing, commercial rents, commute times, climate change, walkability and literally every single thing that would be improved by building more housing? No mention of the fact that a huge proportion of buildings even in Manhattan could not be built today under current zoning?",/r/nyc/comments/j4hhln/new_york_san_francisco_rents_plunge_in_workathome/g7or7rk/
2020-09-28 19:38:03,594,NYT: ‘We’re at War’: New York City Faces a Financial Abyss,/r/nyc/comments/j1pooo/nyt_were_at_war_new_york_city_faces_a_financial/,2020-09-29 09:10:44,2,"Hopefully so, but I wouldn't bet the farm on it, and this thing isn't just 'over' and back to 2019, business as usual. There will be long term structural change in society and the global economy, that results from this and climate change (which are both related- warmer temperatures and increasing population means more pandemics).",/r/nyc/comments/j1pooo/nyt_were_at_war_new_york_city_faces_a_financial/g72fv5i/
2020-09-28 19:38:03,594,NYT: ‘We’re at War’: New York City Faces a Financial Abyss,/r/nyc/comments/j1pooo/nyt_were_at_war_new_york_city_faces_a_financial/,2020-09-29 07:16:27,1,"That's a bit of a false dichotomy. There are certainly people not on either extreme.

Fact is tho, no matter who is in office, the effects of pandemic and climate change (which not incidentally, predictably increases likelihood of pandemics) are not just an easily fixable political problem. Change is inevitable, and it won't necessarily be easy or comfortable.",/r/nyc/comments/j1pooo/nyt_were_at_war_new_york_city_faces_a_financial/g720xpx/
2020-09-28 19:38:03,594,NYT: ‘We’re at War’: New York City Faces a Financial Abyss,/r/nyc/comments/j1pooo/nyt_were_at_war_new_york_city_faces_a_financial/,2020-09-29 09:12:49,2,well hopefully that structural change is not having your city's economy rely on whether rich people stay or not when shit starts to go bad since it's gonna go bad again and again with climate change,/r/nyc/comments/j1pooo/nyt_were_at_war_new_york_city_faces_a_financial/g72g5x2/
2020-09-28 19:38:03,594,NYT: ‘We’re at War’: New York City Faces a Financial Abyss,/r/nyc/comments/j1pooo/nyt_were_at_war_new_york_city_faces_a_financial/,2020-09-29 07:21:18,-1,"That took some mental gymnastics to ""bothsides"" those two issues. There is one side that steadfastly refuses to acknowledge climate change and calls the pandemic a hoax. There are people on the left who proposed a massive plan to address and tackle climate change (not shit it increases the likelihood of pandemics) and they were promptly labeled marxists and communists.",/r/nyc/comments/j1pooo/nyt_were_at_war_new_york_city_faces_a_financial/g721hhu/
2020-09-28 19:38:03,594,NYT: ‘We’re at War’: New York City Faces a Financial Abyss,/r/nyc/comments/j1pooo/nyt_were_at_war_new_york_city_faces_a_financial/,2020-09-29 07:18:19,0,"I'm not altogether anti-her, she's right about climate change.

But you can't say she didn't play a significant role in mobilizing against Amazon.

And it's not just about her, it's about the idea that magical thinking will help us.",/r/nyc/comments/j1pooo/nyt_were_at_war_new_york_city_faces_a_financial/g7215eq/
2020-09-28 10:59:20,95,"New York residential eviction moratorium extended through to Jan. 1, 2021, Cuomo says",/r/nyc/comments/j1fvhy/new_york_residential_eviction_moratorium_extended/,2020-09-28 13:07:03,21,"Government granting all tenants the right to stay rent-free indefinitely, while property-owners still owe their monthly mortgage payments and other fees, is not something any reasonable person would expect or foresee.

These moratoriums don't address the underlying issues, they merely kick the problem down the road a few months. The tenants will still owe the backrent.

This pandemic is imho a compelling argument for UBI. 

Every other method of relief just warps the economy, incentivizes fraud and corporations capturing the funds, and props up unsustainable systems, just like government programs to rebuild homes in fire or hurricane flood zones over and over.

It's a different world now, between wfh and climate change and pandemics. Society needs to restructure, not rebuild the same exact systems in the delusion that it's going to be 2019 again.",/r/nyc/comments/j1fvhy/new_york_residential_eviction_moratorium_extended/g6zegtf/
2020-09-27 19:02:41,83,Dirt bike gangs making loud noises in UES,/r/nyc/comments/j12lg6/dirt_bike_gangs_making_loud_noises_in_ues/,2020-09-28 09:15:36,2,"I am not against enforcing laws - but the public has made it abundantly clear that they don’t want help from the police and want to do everything possible to eliminate the powers and protections afforded to law enforcement in order to prosecute their mission.

So what motivation does law enforcement have to enforce laws? Any interaction with the potential for force will mean the officer will face the ire of the public and potentially face charges from overzealous prosecutors. Until this climate changes, I would not hold my breath on seeing enforcement for anything but major crimes.",/r/nyc/comments/j12lg6/dirt_bike_gangs_making_loud_noises_in_ues/g6yikfl/
2020-09-27 07:54:45,328,NYPD rushes crowd of pedestrians/diners in West Village,/r/nyc/comments/j0rhcc/nypd_rushes_crowd_of_pedestriansdiners_in_west/,2020-09-27 14:02:24,-1,"I have too, I also heard them take a protestor that broke a window yesterday and hand them to the police. That’s protesting, but they caused a gridlocked Friday and yesterday that hindered ems from crossing the Brooklyn bridge to transport patients. PD was calling for help moving protestors yesterday so they could get moving. 

Also there is 10 seconds clips of this “brutality” and plenty of longer videos that disprove 99 percent of it. There are cops that did act too far and were fired/suspended without pay. NYC does not support or help their cops at all with debozo in office. I saw plenty of protests yesterday were cops walked with the people and blocked roads for them to cross the street. Them doing that allowed police to prepare to block roads and keep them safe. Cops also prevent you from entering private parks/closed parks that way no laws are broken. 

For example, climate change activists on Friday spoke to their local precinct and had a protests escorted by the police. It was calm, plenty of attention was brought to it and nobody got hurt. Cops don’t care if you protest, but when they say “listen you can’t go here” for a number of reasons, pushing them or just screaming instead of talking to them helps nobody. 

There is at least one protest a day in NYC, why is it only this group has an issue with the nypd? You don’t think maybe it’s some of the protestors causing problems?",/r/nyc/comments/j0rhcc/nypd_rushes_crowd_of_pedestriansdiners_in_west/g6vrgpl/
2020-05-31 14:27:16,4,Why why why throw away your entire life,/r/nyc/comments/gu6aw1/why_why_why_throw_away_your_entire_life/,2020-05-31 15:24:33,9,"Agreed. You add four years of misleadership, deepening wealth gaps, now 40 mil unemployed, COVID, climate change and the rest and this is where it’s led. We’ve gotten off relatively easy for the last 50ish years in terms of an actual overthrowing of the government which is no longer serving the people, never served certain communities to begin with and now we’re here. 

Were either going to see political reform begin to take place or were going to prostrate further to our corporate overlords. 

Peaceful protests in the last 30 years only have lead to zero reform. We think back to Rodney king, to Amadou Diallo, Trayvon, Eric Gardner, Philando Castile, and many other PoC sacrificed to police/rogue vigilante violence.

How many more have to be killed? When do we wake up and confront this hideous truth? Our country is horrendously broken.",/r/nyc/comments/gu6aw1/why_why_why_throw_away_your_entire_life/fsgls17/
2017-01-22 09:12:44,185,Protesting is fine but clean up your city when you leave.,/r/nyc/comments/5phqsq/protesting_is_fine_but_clean_up_your_city_when/,2017-01-22 12:32:54,-38,"OMG, the environment, climate change.",/r/nyc/comments/5phqsq/protesting_is_fine_but_clean_up_your_city_when/dcrhyi7/
2017-01-22 09:12:44,185,Protesting is fine but clean up your city when you leave.,/r/nyc/comments/5phqsq/protesting_is_fine_but_clean_up_your_city_when/,2017-01-23 06:30:07,5,">I call assaulting people 

Zero arrests in DC.  This was probably one of the most peaceful large protests per capita in American history. 

>and clogging infrastructure 

On a Saturday.

>just so you can whine about a democratic election in large groups gross. 

Aka exercising their constitutional rights of free speech and assembly. So again I say, shame on you. You're being a shitty American. 

>I call leaving your trash in the middle of the street despicable.

I call it ""following instructions"". Regardless, pretty rich that you're criticizing protesters for trashing city streets, despite your presumably voting for a man who will enact policies that will trash the entire planet and who thinks climate change is a hoax. ",/r/nyc/comments/5phqsq/protesting_is_fine_but_clean_up_your_city_when/dcsmc4z/
2020-07-09 10:36:44,0,Painting the words “Black Lives Matter” on Fifth Ave in front of Trump Tower,/r/nyc/comments/ho6ba2/painting_the_words_black_lives_matter_on_fifth/,2020-07-10 12:34:41,0,"Wow this is one of the worst takes on this that I’ve seen. The equivalent of if Save the Whales spent 100% of their time talking about whale poaching and 0% of their time talking about ocean pollution and climate change. Only talking about police brutality in terms of black lives is insane. It’s one of the things that statistically affects black lives the least. Also, go on their website and read their mission statement. They are about other things. They just are an inept and probably corrupt organization.",/r/nyc/comments/ho6ba2/painting_the_words_black_lives_matter_on_fifth/fxk20sh/
2020-05-04 10:40:59,5,ELI5: Why is it such a big deal that NY canceled the Primaries when Joe Biden is the only candidate running?,/r/nyc/comments/gdezqd/eli5_why_is_it_such_a_big_deal_that_ny_canceled/,2020-05-04 13:18:13,-1,"Everyone being allowed to vote for Bernie in primaries and collect delegates will be the only reason Biden will be forced to attempt to do something about Climate Change, Universal Health Care, Debt Relief, Wealth Tax, College for All, Justice Reform, Campaign Finance Reform....among other things Biden wouldn’t touch unless Bernie is bringing a good number of delegates to the convention. 

So yes, it’s important that we all vote for Bernie in the primaries.",/r/nyc/comments/gdezqd/eli5_why_is_it_such_a_big_deal_that_ny_canceled/fphekhk/
2019-02-08 11:05:08,26,Ocasio-Cortez celebrates as Amazon reconsiders HQ2 deal,/r/nyc/comments/aoj87z/ocasiocortez_celebrates_as_amazon_reconsiders_hq2/,2019-02-08 17:45:10,4,"The Green New Deal is admittedly a bit insane(banning cars, including stuff that has nothing to do with climate change), but AOC has every right to stand up against something happening in her district that she disagrees with. After all, she's supposed to rep her constituents ",/r/nyc/comments/aoj87z/ocasiocortez_celebrates_as_amazon_reconsiders_hq2/eg240sh/
2019-03-06 03:13:05,11,Who can I call (aside from the NYPD) to discourage the resident homeless man on my street from talking to me?,/r/nyc/comments/axx9lw/who_can_i_call_aside_from_the_nypd_to_discourage/,2019-03-06 20:36:18,2,"You're not really on the team you think you are. And you should be watching what's happening to refugees to understand what will happen to the rest of the people once our planet gets fucked. 

I'm a latino man that can (mostly) pass for white, but I know that the real ""white culture"" is chomping at the bit to create another holocaust, except this time with the help of tech companies and much larger populations of possible targets. We're already seeing the anti-semitic backlash from refugees that come from middle-eastern nations. Once Climate Change shifts into overdrive we're gonna start seeing real bad shit. This miserable decade is only the beginning. 

",/r/nyc/comments/axx9lw/who_can_i_call_aside_from_the_nypd_to_discourage/ehyxbzf/
2019-06-11 15:29:23,2,Subway Commuters Avoid Paying Their Fare: Caught On Hidden Camera,/r/nyc/comments/bzig8t/subway_commuters_avoid_paying_their_fare_caught/,2019-06-11 17:05:30,3,"This is some ignorant ass shit. 

To me this is like climate deniers.   The earth's climate changes. I feel like a chump having to pay extra for LED bulbs or electric cars. Blah blah blah.",/r/nyc/comments/bzig8t/subway_commuters_avoid_paying_their_fare_caught/eqsuqvf/
