2019-10-01 06:47:25,2061,Spotted on the G train this evening,/r/nyc/comments/dbsvsf/spotted_on_the_g_train_this_evening/,2019-10-02 14:51:15,1,"[Far more revenue is spent on roads than is spent on mass transit](https://cbcny.org/research/building-sound-fiscal-future-new-yorks-highway-and-mass-transit-systems)

If NYC is really trying to be a leader in the shift towards lower emissions to prevent climate change (as the Mayor and others purport it to be), it really ought to reflect that in how it allocates the budget.

Demand for subway and other transit could easily be eased by providing safer options for walking and micromobility. Building up the infrastructure for non-car and non-transit use would go a long way in the city. But all de Blasio does is spend more taxpayer money on keeping drivers happy while keeping pedestrians and cyclists in danger.",/r/nyc/comments/dbsvsf/spotted_on_the_g_train_this_evening/f27zn6l/
2019-09-15 17:13:07,2054,"DUMBO circa 1970's No tourists, no visible millionaires, should have bought the block!",/r/nyc/comments/d4s8q3/dumbo_circa_1970s_no_tourists_no_visible/,2019-09-15 23:00:08,6,Sea walls are cheap and water level rise is slow. NYC isn't going anywhere due to climate change.,/r/nyc/comments/d4s8q3/dumbo_circa_1970s_no_tourists_no_visible/f0h0646/
2019-01-11 04:41:37,2037,Let it snow,/r/nyc/comments/aeuktf/let_it_snow/,2019-01-12 09:33:02,2,"Nope. For what it's worth, this is the first time in the nearly 15 years I've lived all over the US (including the southwest!) that the year has ended with no snow worth noting. 

Climate change is coming for us all, and we're doing nowhere near enough.",/r/nyc/comments/aeuktf/let_it_snow/edwg5c6/
2019-09-10 06:10:50,2036,Show me the lie,/r/nyc/comments/d26nfr/show_me_the_lie/,2019-09-10 21:28:11,3,"If you believe substantial action on climate change or poverty are less important than the deficit or low taxes then you believe markets are more important than human lives. As I pointed out earlier, the idea of the “far” left is relative and only makes sense in a field where everything has moved right. I think you seem nice, and I hope you look at what’s really at stake and what’s really on offer.",/r/nyc/comments/d26nfr/show_me_the_lie/ezvbgz1/
2019-09-10 06:10:50,2036,Show me the lie,/r/nyc/comments/d26nfr/show_me_the_lie/,2019-09-10 21:32:48,3,"Dude I'm currently living in the Caribbean, I have my fan at full speed right now, I'm hot, I care about climate change and I think it is more important than anything. Every summer is worse and worse. I've never had a summer where the water in the shower was warm. I'm glad at least it's over.",/r/nyc/comments/d26nfr/show_me_the_lie/ezvbsji/
2019-09-10 06:10:50,2036,Show me the lie,/r/nyc/comments/d26nfr/show_me_the_lie/,2019-09-10 21:43:30,1,I’m for combating climate change. Nuclear is fine but the real problem isn’t energy its fucking policy.,/r/nyc/comments/d26nfr/show_me_the_lie/ezvcire/
2020-09-24 16:22:56,2030,I had a day and night in NYC and it is a beautiful city you have there.,/r/nyc/comments/iz793v/i_had_a_day_and_night_in_nyc_and_it_is_a/,2020-09-25 00:52:47,5,Hey guy You realize 25% percent of California’s pollution alone is a direct result of China? They are horrificly worse. Stay in your poorly educated country that apparently didn’t properly teach you who/what contributes to climate change. But keep hating us on ur American iPhone on an American app...the disillusionment is all yours,/r/nyc/comments/iz793v/i_had_a_day_and_night_in_nyc_and_it_is_a/g6ihlea/
2018-09-11 12:02:24,2006,FUCKING VOTE THIS THURSDAY.,/r/nyc/comments/9ezv94/fucking_vote_this_thursday/,2018-09-11 21:17:45,4,"a quick look at their comment history and it looks like they are very proud of their work securing financing for public/private partnerships to create parks or other municipal works (which is not a bad way to spend your time). That being said, it makes a lot of sense that their theory of political change is one of cooperation and conciliation with entrenched power. I'm sure they know a political method to make some nice parks (which is why they're obsessed with tone and why they absolutely hate protests and direct actions), but it's insane to think that those processes will do anything to help any causes that actually challenge entrenched interests, like get poor people healthcare, fight climate change, end cash bail etc.",/r/nyc/comments/9ezv94/fucking_vote_this_thursday/e5tp1tg/
2019-01-09 04:57:06,1992,New York public library,/r/nyc/comments/ae65cy/new_york_public_library/,2019-01-09 11:45:29,3,"A perfect place to shelter when a massive winter storm caused by climate change hits.

(Those who watch movies know what I'm talking about)",/r/nyc/comments/ae65cy/new_york_public_library/ednignr/
2020-05-30 07:18:39,1979,Bill DeBlasio needs to resign,/r/nyc/comments/gte5p0/bill_deblasio_needs_to_resign/,2020-05-30 11:29:25,2,He has been responsible (though not all on his own) for nyc being one of the leading cities in the world targeting policies that mitigate and prepare for the impacts of climate change,/r/nyc/comments/gte5p0/bill_deblasio_needs_to_resign/fsbpznu/
2020-05-30 07:18:39,1979,Bill DeBlasio needs to resign,/r/nyc/comments/gte5p0/bill_deblasio_needs_to_resign/,2020-05-30 13:50:45,7,"Older voters, AKA people who vote and especially vote Democrat, did not want a progressive. The other moderates dropping out was because they had no chance left and knew they could push for more of their own ideals with Biden. Warren was a progressive too, yet she dropped out at the same time because she knew her campaign had little momentum left. You're also seriously fucking delusional if you think the man who pushes for increased mobility and prosperity for minorities, climate change reform, and a ton of other progressive issues is conservative. Maybe you should check out his website instead of listening to Twitter.",/r/nyc/comments/gte5p0/bill_deblasio_needs_to_resign/fscea1j/
2019-11-21 09:26:10,1975,The best tweet I’ve ever seen from the NYCT subway account,/r/nyc/comments/dzlq9t/the_best_tweet_ive_ever_seen_from_the_nyct_subway/,2019-11-21 09:48:36,833,"Their sincere response is even better:

> But actually, we were testing a new ""flex gate,"" which is a flood  barrier that would allow us to seal off a subway entrance. We ""test  flood"" the entrance for four hours to make sure it was installed  correctly, which it was!   
  
>  
>**We're doing this because climate change is real. \^JLP** 

Emphasis mine.",/r/nyc/comments/dzlq9t/the_best_tweet_ive_ever_seen_from_the_nyct_subway/f88hsx6/
2019-11-21 09:26:10,1975,The best tweet I’ve ever seen from the NYCT subway account,/r/nyc/comments/dzlq9t/the_best_tweet_ive_ever_seen_from_the_nyct_subway/,2019-11-21 15:53:25,10,"Read Kim Stanley Robinson's NY 2140. All about NY after climate change. Manhattan is flooded below around 50th St. People still live in the buildings and get around by boat and bridge. But the farther downtown you go the less stable the buildings are. The tend to collapse. So yes, rent downtown will be lower.",/r/nyc/comments/dzlq9t/the_best_tweet_ive_ever_seen_from_the_nyct_subway/f89or92/
2019-07-31 07:22:07,1940,Growing corn in the middle of Manhattan.,/r/nyc/comments/ck8fw0/growing_corn_in_the_middle_of_manhattan/,2019-07-31 08:29:09,84,"We did it guys, climate change averted! Back to work.",/r/nyc/comments/ck8fw0/growing_corn_in_the_middle_of_manhattan/evkls08/
2019-07-31 07:22:07,1940,Growing corn in the middle of Manhattan.,/r/nyc/comments/ck8fw0/growing_corn_in_the_middle_of_manhattan/,2019-07-31 09:10:14,9,"Vert farms in cities (or nearby suburbs) reduce needs for transportation from far away fields to the largest # of consumers. Indoor vert farms are far better at water useage and vastly reduce the need for petrochem fertilizers and pesticides. By recycling and reducing water waste, chemicals like phosphorus don't make their way into nature creating toxic algae. With the rapid changes climate change is bringing, we can't rely on farmland for long as either crops will be flooded out like this year or long droughts that will create Dustbowl 2.0.",/r/nyc/comments/ck8fw0/growing_corn_in_the_middle_of_manhattan/evksj14/
2020-06-23 21:16:47,1920,AOC wins primary re-election with over 70% of the vote,/r/nyc/comments/het7tc/aoc_wins_primary_reelection_with_over_70_of_the/,2020-06-24 18:57:10,-1,"But what has she actually accomplished?  Federal money that she's brought home to her district?  As far as I know, the only thing she's managed to ""accomplish"" are:

- Increase her national profile
- Block 25K jobs in the district next to hers
- Release the embarrassment that was the ""Green New Deal"" (And I'm saying that as someone who believe climate change is very much a concern)",/r/nyc/comments/het7tc/aoc_wins_primary_reelection_with_over_70_of_the/fvwrjbj/
2020-06-23 21:16:47,1920,AOC wins primary re-election with over 70% of the vote,/r/nyc/comments/het7tc/aoc_wins_primary_reelection_with_over_70_of_the/,2020-06-24 09:27:18,0,"Imagine ""too far left"" for the middle states means that she will actually fight to mitigate the effects of climate change and that people will be able to go to the doctor without financial ruin.",/r/nyc/comments/het7tc/aoc_wins_primary_reelection_with_over_70_of_the/fvuyamd/
2020-06-23 21:16:47,1920,AOC wins primary re-election with over 70% of the vote,/r/nyc/comments/het7tc/aoc_wins_primary_reelection_with_over_70_of_the/,2020-06-24 07:06:31,9,You realize that climate change is going to destroy our country regardless right?,/r/nyc/comments/het7tc/aoc_wins_primary_reelection_with_over_70_of_the/fvuizuh/
2018-11-13 16:33:34,1920,Bezos' Helipad,/r/nyc/comments/9wufk9/bezos_helipad/,2018-11-14 06:14:30,1,"I'm not pessimistic at all, I have no idea how you got that! I'm totally optimistic that we can get through the capitalist crisis together. Yes, capitalism has generated grinding poverty for the majority of human beings on earth, it has dispossessed backwoods farmers of their land in Mexico and Nigeria and India and forced them to work in factories, and worst of all, it has rewarded behavior which has caused climate change and actually threatens our capacity to feed the world. Acknowledging the systemic nature of these crises is not pessimism, it is simply acknowledging reality. 

But, despite the grim state of things, I think as the crisis worsens, we'll see a resurgence in anticapitalist politics, union membership, and perhaps get closer to a General Strike which reminds those who lord over us with their exotic cars and mansions and stock options while we freeze and starve - that without the working class, their money and wealth means nothing. Already lots of young people are refusing to work - and we're building off-grid cabins and gardens and letting our student loans go into default. We aren't spending money, and we're sending a message that people ain't feeling this bullshit anymore. This will bloom into full-scale resistance, and we'll be able to establish worker control of our workplaces, build worker co-ops and community subsistence programs and so on. 

I don't mean any disrespect to your struggle, but remember that not everyone can walk door to door. Some of my friends have been caught up in slum-level poverty for so long, they don't know how to talk to people outside their bubble. Big black dudes with felonies and face tattoos can't go door to door most places. Immigrants without papers who stay for their families can't do that. There are only so many ways the bootstraps thing works - but socialism is for *everyone*. We don't need to hold one another in contempt in a nation where we'd all be millionaires if the wealth were evenly distributed, and most productive tasks could be automated and the total working hours of the entire nation could be slashed radically. I'm optimistic that we'll get there, despite disinformation, propaganda, and a compromised political system - and despite the constant efforts of the elite to keep the working class down and divided.",/r/nyc/comments/9wufk9/bezos_helipad/e9oevcd/
2020-04-23 10:12:02,1874,Cuomo crucifying McConnell hard right now and I love it.,/r/nyc/comments/g6phkq/cuomo_crucifying_mcconnell_hard_right_now_and_i/,2020-04-23 12:32:42,7,"I figured you would, I just had to put that idea out there as a general pathway to maybe, hopefully, starting to undo the damage we're currently incurring after years of right wing programming.

It's too big to ignore at this point. With something like this pandemic, with climate change, with inequality, localized partisan ignorance affects us all.",/r/nyc/comments/g6phkq/cuomo_crucifying_mcconnell_hard_right_now_and_i/foc3q5t/
2020-04-23 10:12:02,1874,Cuomo crucifying McConnell hard right now and I love it.,/r/nyc/comments/g6phkq/cuomo_crucifying_mcconnell_hard_right_now_and_i/,2020-04-23 13:39:59,2,"Sure, it's the idea is that humans are the problem and not the inherent flaws of the money worshiping system we've put in place that rewards the decimation of our planet's ecosystem. It ties into the malthusian (after Thomas Malthus, who is widely regarded as a quack by economists and environmentalists alike but has gained prominence again) theory that overpopulation is the problem and not the inherent flaws in rampant capitalism which contribute to propping up industries that contribute to climate change. 

It's a simple answer to a complex problem that live-love-laugh liberals cling to to appear deep and intellectual and it's infuriating. We have the resources to be healthy and live good lives while keeping our planet pollution free but we choose not to. It's not overpopulation, it's not the human ""condition"", its tar spewing, river blackening bellows of unchecked capitalism.",/r/nyc/comments/g6phkq/cuomo_crucifying_mcconnell_hard_right_now_and_i/focfqbh/
2020-04-23 10:12:02,1874,Cuomo crucifying McConnell hard right now and I love it.,/r/nyc/comments/g6phkq/cuomo_crucifying_mcconnell_hard_right_now_and_i/,2020-04-23 14:23:24,2,"Democrats push green policies to help stop climate change, Republicans want to burn the environment.  Democrats advance healthcare in a way that's more fair for everyone versus Republicans who have no plan and just want to end Obamacare.  Democrats can put together a comprehensive and legible foreign policy, Republcans enable Trump who **tweets** threats of military violence to other countries *before telling the Pentagon anything.*

Like, jesus fucking christ you're delusional with this ""both sides"" shit.",/r/nyc/comments/g6phkq/cuomo_crucifying_mcconnell_hard_right_now_and_i/focncal/
2020-04-23 10:12:02,1874,Cuomo crucifying McConnell hard right now and I love it.,/r/nyc/comments/g6phkq/cuomo_crucifying_mcconnell_hard_right_now_and_i/,2020-04-23 14:34:05,1,"> Democrats push green policies to help stop climate change

Right except when it comes to actually creating the law. Do you think Pelosi is more likely to endorse and fight for the Green New Deal or approve the Trump admin's climate policies? I'll give you a hint, we already have the answer dozens of times over.

> Democrats advance healthcare in a way that's more fair for everyone

Not only is it a total fucking sham to pretend that Obamacare did this, the DNC literally spent this whole cycle uniting and closing ranks to absolutely oppose universal healthcare. lmao they didn't even lie about it, they're more concerned with assuring the insurance industries that they're chill than they are with pretending to be on your side for votes. They would literally rather lose and get the Republican policies -- which work just fine for them and their backers -- than lose the support of the insurance industry, which affects their personal bottom lines.

> Democrats can put together a comprehensive and legible foreign policy, Republcans enable Trump who tweets threats of military violence to other countries before telling the Pentagon anything.

Does this mean anything beyond ""my media bubble presents turmp as embarassing!""? They're gonna fight the same dirty wars and bomb the same people. What legible foreign policy? having a nice smile with the President of France? Who fucking gives a shit they'll be in exactly the same imperial wars of aggression. Ohhh nooo he didn't talk to the Pentagon! All the same military adventures, but his tweeeets!",/r/nyc/comments/g6phkq/cuomo_crucifying_mcconnell_hard_right_now_and_i/focp5mx/
2020-07-05 09:39:12,1869,This is what happens when amateurs use fireworks,/r/nyc/comments/hlom02/this_is_what_happens_when_amateurs_use_fireworks/,2020-07-05 10:28:32,-33,So it's only a fucking climate change apocalypse if I use a plastic straw?,/r/nyc/comments/hlom02/this_is_what_happens_when_amateurs_use_fireworks/fx0dvx0/
2020-09-23 06:25:57,1861,New York considers hiking taxes for the rich to fill COVID-19 hole,/r/nyc/comments/iy931p/new_york_considers_hiking_taxes_for_the_rich_to/,2020-09-23 15:20:22,2,"I can’t be sure if you are mocking me or not, but regardless I think the issue is that even the so-called “leftists” arguing with me seem to still be looking at everything through a capitalist lens.

They misunderstand. I’m not interested in “rehabilitating” capitalism. A wealth tax, in my
opinion, is the equivalent of sticking a band aid on an open wound. 

“Radical” sure, but I am beyond the point of thinking we can fix issues like homelessness or climate change through a “nicer” form of capitalism.",/r/nyc/comments/iy931p/new_york_considers_hiking_taxes_for_the_rich_to/g6cx6tm/
2018-01-07 05:30:02,1849,The East River is starting to freeze,/r/nyc/comments/7oqbum/the_east_river_is_starting_to_freeze/,2018-01-07 12:27:33,17,"https://www.nasa.gov/mission_pages/noaa-n/climate/climate_weather.html

> The difference between weather and climate is a measure of time. Weather is what conditions of the atmosphere are over a short period of time, and climate is how the atmosphere ""behaves"" over relatively long periods of time.

>When we talk about climate change, we talk about changes in long-term averages of daily weather. ",/r/nyc/comments/7oqbum/the_east_river_is_starting_to_freeze/dsbxf00/
2018-01-07 05:30:02,1849,The East River is starting to freeze,/r/nyc/comments/7oqbum/the_east_river_is_starting_to_freeze/,2018-01-07 16:25:17,1,"I assume you're trolling because this post is so stupid, but I  case you're serious- 

Climate change doesnt mean that the entire planet uniformly gets hotter, it means that the....climate...changes. the jet stream moves, planetary climate systems move, places get hotter, and colder. Climate change means that a lot of populated areas get their weather patterns messed up. Hurricanes happen me often, the seas rise, the oceans get hotter and kill off life....it's a huge interconnected Web of activity. ",/r/nyc/comments/7oqbum/the_east_river_is_starting_to_freeze/dscalfr/
2018-04-16 16:08:44,1821,Feels like we’ve gone through all 4 the past week,/r/nyc/comments/8cri17/feels_like_weve_gone_through_all_4_the_past_week/,2018-04-16 23:47:06,7,Climate changes (either man made or natural) that some people are so sure that it's a hoax.,/r/nyc/comments/8cri17/feels_like_weve_gone_through_all_4_the_past_week/dxhw75p/
2019-05-17 19:01:11,1815,"It sucked calling the police on my local slice joint, but this was clearly a case of ‘if you see something, say something’",/r/nyc/comments/bpz7nb/it_sucked_calling_the_police_on_my_local_slice/,2019-05-18 09:35:12,2,Should be the first and outermost circle of hell. Heat rises so if you want them to burn in hell the first circle is the hottest. The innermost is frozen solid and is the only thing that's been keeping our planet from further effects of climate change.,/r/nyc/comments/bpz7nb/it_sucked_calling_the_police_on_my_local_slice/eo1864r/
2018-04-15 08:37:36,1816,"Why, weather, why?",/r/nyc/comments/8cfi6r/why_weather_why/,2018-04-15 09:19:25,30,Not to be that guy but climate change makes weather extremes in both directions :),/r/nyc/comments/8cfi6r/why_weather_why/dxek2f5/
2018-04-15 08:37:36,1816,"Why, weather, why?",/r/nyc/comments/8cfi6r/why_weather_why/,2018-04-15 09:21:37,-35,"It's almost as if they changed their prediction to ""climate change"" so they couldn't possibly be wrong again.",/r/nyc/comments/8cfi6r/why_weather_why/dxek6im/
2018-04-15 08:37:36,1816,"Why, weather, why?",/r/nyc/comments/8cfi6r/why_weather_why/,2018-04-15 09:31:56,-37,"It got how many degrees warmer exactly? Also, can you count how many of Al Gore's ""climate change"" predictions have come true since he first warned us over ten years ago? I'll give you a hint, it's less than a million, as in the millions people like him have made off of the global warming documentary he made. The climate has always and will always change and this is shown historically as well.",/r/nyc/comments/8cfi6r/why_weather_why/dxekq5l/
2020-09-16 18:58:22,1779,"New York City’s shutdown reduced spread of coronavirus by 70 percent, study finds",/r/nyc/comments/iu8zny/new_york_citys_shutdown_reduced_spread_of/,2020-09-17 12:01:38,1,"But you are a mask denier, pandemic denier and climate change skeptic.

Why should anyone listen to anything you say?",/r/nyc/comments/iu8zny/new_york_citys_shutdown_reduced_spread_of/g5m0mtn/
2020-09-16 18:58:22,1779,"New York City’s shutdown reduced spread of coronavirus by 70 percent, study finds",/r/nyc/comments/iu8zny/new_york_citys_shutdown_reduced_spread_of/,2020-09-17 12:35:46,-1,"I am none of those, even though you keep combing my history and following me around trying to insist I am. I wear a mask (though I don't think it is necessary outdoors).  I do think there is a virus, but that it has been way overblown since we learned in April that the IMHE model was totally wrong and the IFR was way lower than we thought. I believe that the extended lockdowns are going to have much more catastrophic consequences than the virus ever could.  And I am not a climate change skeptic either, I think that it will be the next tool of social control after the pandemic, but that does not deny its existence. If you would like to have a rational, evidenced-based discussion on any of those topics, feel free, but if you are going to continue to harass me I will report you.",/r/nyc/comments/iu8zny/new_york_citys_shutdown_reduced_spread_of/g5m5o30/
2019-08-18 18:07:38,1755,"WTF, NYC",/r/nyc/comments/cs9ald/wtf_nyc/,2019-08-19 00:34:58,1,"Climate change, bud",/r/nyc/comments/cs9ald/wtf_nyc/exe3c8n/
2019-09-22 09:53:10,1750,Unvaccinated Children Are Now Barred From Going To School In New York — And Their Anti-Vax Parents Are Really Mad,/r/nyc/comments/d7s9l3/unvaccinated_children_are_now_barred_from_going/,2019-09-23 07:42:47,5,That must be around where he commands his followers to cut taxes for the megarich and burn all the oil in the ground whilst denying climate change is real.,/r/nyc/comments/d7s9l3/unvaccinated_children_are_now_barred_from_going/f17osr9/
2019-09-16 17:46:00,1693,Elizabeth Warren Rally at Washington Square Park,/r/nyc/comments/d58rzg/elizabeth_warren_rally_at_washington_square_park/,2019-09-16 21:07:13,9,"To leave it would be to give Mitch a veto over addressing climate change and expanding health care coverage. Nothing will pass. The GOP gains nothing by scrapping it, theyve already scrapped it for SC justices and can pass tax cuts with reconciliation",/r/nyc/comments/d58rzg/elizabeth_warren_rally_at_washington_square_park/f0kw0wc/
2019-09-16 17:46:00,1693,Elizabeth Warren Rally at Washington Square Park,/r/nyc/comments/d58rzg/elizabeth_warren_rally_at_washington_square_park/,2019-09-16 21:56:39,5,Not to mention the threat to human existence from climate change!,/r/nyc/comments/d58rzg/elizabeth_warren_rally_at_washington_square_park/f0kzdce/
