2019-11-08 13:05:20,255,Bloomberg 2020?,/r/nyc/comments/dtkxnx/bloomberg_2020/,2019-11-08 14:58:46,41,"Foh with these smears from a Q clown.

I won't be voting for him in the primary but Bloomberg is a decent, intelligent, self-made American-Dream story. He is everything Trump pretends to be but isn't. 

To the liberals who are all too happy to pile on and go along with this BS (like Vice yesterday) - We could do MUCH worse than Bloomberg as POTUS.  And I say that as a Warren/Bernie supporter. I would love to elect a legit progressive and overhaul the system as they plan to, but if we end up with a moderate then we could do MUCH worse than Bloomberg.  If he does enter the race he immediately jumps to 4th on my list.  Warren, Bernie, Pete, Bloomberg.  

Bloomberg won't do nearly enough for inequality and has no interest in M4A but he will actually prioritize climate change and he will SINK the NRA once and for all.  A Bloomberg presidency means the end of the NRA. And he isn't using climate change as a political football like some others. He truly believes/understands the threat it presents.  

He was the mayor of NYC and one of the most successful businessmen to ever live ffs.  He has taken photos with thousands (millions?) of people. Unless there's more to this than a picture (there isn't) it's utterly meaningless.",/r/nyc/comments/dtkxnx/bloomberg_2020/f6ximyb/
2019-06-18 19:56:54,0,Top 10 ways NYC is better than LA.,/r/nyc/comments/c2b1q2/top_10_ways_nyc_is_better_than_la/,2019-06-18 20:15:42,11,"Some of your points are fine, but most are dumb. 

LA has the Getty Museum which is quite famous. And the Griffith Observatory, arguably the most famous observatory in the world. Sure NYC has more museums but LA isn’t lacking.

Gas prices being high is actually a good thing for climate change.

Unless you’re far inland, SoCal weather is rather moderate. I love this city, but NYC weather absolutely sucks.

LA is incredibly diverse. They have a huge population of various Asian nationalities.",/r/nyc/comments/c2b1q2/top_10_ways_nyc_is_better_than_la/eriycco/
2019-11-24 16:31:59,0,Mayhem At New York Mall as 200 Teens Start Massive Riots and Fights Break Out in All Out Brawl,/r/nyc/comments/e16wgq/mayhem_at_new_york_mall_as_200_teens_start/,2019-11-24 20:25:22,-2,But climate change.,/r/nyc/comments/e16wgq/mayhem_at_new_york_mall_as_200_teens_start/f8nt64h/
2014-12-23 07:18:17,2,"New York to tackle subway's ""manspreading"" scourge",/r/nyc/comments/2q6c6m/new_york_to_tackle_subways_manspreading_scourge/,2014-12-23 12:15:55,9,"Amazing. You can literally take anything, slap a feminism label on it, and get, like, immediate action.

Can we use this to solve... actual problems? ""Hey NYPD, stop killing young black men! Check your male privilege!"" ""Pass Climate Change Legislation Now! Stop Pollution, or as I call it... Mansplution! Defend Women's Rights!"" ""Hey crazy people, don't kill cops! Get help for your MANStal illness!"" ""Legalize Marijuana! This is what a feminist tokes like!""",/r/nyc/comments/2q6c6m/new_york_to_tackle_subways_manspreading_scourge/cn3i12y/
2017-01-28 07:45:03,5626,Support petition for NYC taxpayers to stop paying $1M a day for Melania to live here,/r/nyc/comments/5qnv4s/support_petition_for_nyc_taxpayers_to_stop_paying/,2017-01-29 17:32:38,1,"the vast majority of people vote in their own self interest, its fine. I don't blame others for it. I mean people supported Hillary just because she was a woman, which is a much worse reason for voting. And its not like republican economic policy is that unreasonable, most of their unreasonable policies are things like climate change. And many less fortunate people despise the 1%, yet if one of them used that argument they would be considered an asshole. ",/r/nyc/comments/5qnv4s/support_petition_for_nyc_taxpayers_to_stop_paying/dd2ssx2/
2017-01-28 07:45:03,5626,Support petition for NYC taxpayers to stop paying $1M a day for Melania to live here,/r/nyc/comments/5qnv4s/support_petition_for_nyc_taxpayers_to_stop_paying/,2017-01-29 18:27:57,1,"Climate change and social issues are definitely areas where Republican's jump the shark, but I would hardly call their economic policies reasonable. From what I hear they're still caught up in this ridiculous suppy-side economics which any respectable economist laughs in the face of. Paul Krugman said ""The specific set of foolish ideas that has laid claim to the name 'supply side economics' is a crank doctrine that would have had little influence if it did not appeal to the prejudices of editors and wealthy men"" - and that's exactly it. Your dislike of taxation is being used by the 1% to enrich themselves to the detriment of everyone else.

I would go on to say that it is very reasonable to despise 'the 1%', but I bet that 1% aren't voting Democrat - they're voting Republican.",/r/nyc/comments/5qnv4s/support_petition_for_nyc_taxpayers_to_stop_paying/dd2vcn1/
2020-08-25 14:38:09,4779,True,/r/nyc/comments/igkk6c/true/,2020-08-26 12:05:14,1,"With climate change raging on, I don't think this cycle will play out exactly as before. Would a much poorer NYC be able to afford measures to mitigate climate change effects like sea level rise? Manhattan is barely above water like now, building levies and such are engineering projects on a whole different scale. Automation is accelerating now due to covid, and the world is going through a transformation. IMO the worry is warranted.",/r/nyc/comments/igkk6c/true/g2xn02f/
2020-09-22 13:08:44,4759,Footage of the anarchy happening in NYC right now,/r/nyc/comments/ixu0ed/footage_of_the_anarchy_happening_in_nyc_right_now/,2020-09-22 16:27:56,2,"Well, that's probably gonna happen in a few decades anyways if we don't get our act together about climate change.",/r/nyc/comments/ixu0ed/footage_of_the_anarchy_happening_in_nyc_right_now/g69ekka/
2016-01-23 18:09:16,4636,12 hours in Brooklyn,/r/nyc/comments/42ds1j/12_hours_in_brooklyn/,2016-01-24 11:11:28,1,"I'm not a climate change denier, but I've lived here for 28 years and there's nothing strange about this.  Every winter we get snow, some years it's worse than others, but a snow storm in January in NYC is nothing out of the ordinary.  It's more rare that we get 2 feet in a single storm but certainly not unheard of.",/r/nyc/comments/42ds1j/12_hours_in_brooklyn/cza72a9/
2020-08-12 00:28:12,4538,This is the new “you’re not a real New Yorker...”,/r/nyc/comments/i88q4c/this_is_the_new_youre_not_a_real_new_yorker/,2020-08-12 09:35:29,121,"I don't have to see the Maldives myself to believe in climate change. 

The folks who deny this virus are not influenced by facts. Frankly, hearing an expert speak just makes them dig their heels in. Virus deniers are folks who have been taught their whole lives not to trust anyone with more education than themselves. America has been destroying education for 30+ years, and we've hit a critical mass where people are now more willing to die than they are to admit anyone knows more than them. The entire world was on fire, a few trucks and a few dead parents here in NY aren't enough to convince people who've made ignorance into a personality trait.",/r/nyc/comments/i88q4c/this_is_the_new_youre_not_a_real_new_yorker/g18196b/
2020-06-03 09:22:27,4316,"""Chair of New York City Council health committee""",/r/nyc/comments/gvvwrt/chair_of_new_york_city_council_health_committee/,2020-06-03 11:06:54,3,"That's bullshit and you know it. Biden has policy up the wall and Democrats campaign constantly on expanded access to affordable health care, climate change, consumer protection, support services, infrastructure, voting rights and tons of other issues. It's not ""we're not Trump"".",/r/nyc/comments/gvvwrt/chair_of_new_york_city_council_health_committee/fsrk6gf/
2020-03-02 04:58:03,4017,Probably accurate,/r/nyc/comments/fcb055/probably_accurate/,2020-03-02 07:42:05,-26,"I’m gonna be the guy who doesn’t care about the hype around this, et the disease, let my immune system kill it, then go to the CDC and donate my blood for thousands of dollars for the cure.

Ima be rich while everyone else is scared of sneezes.

With that said, I am a 35 y/o male in peak physical condition. I wouldn’t recommend children or anyone over 60 to go anywhere close to exposure. This disease clearly effects the elderly at a higher rate.

We will live on. I’ve survived killer bees, Swine Flu, Bird Flu, the Glaciers melting and the amazon burning. Global Cooling, Global Warming, and Climate Change.

I’m ready!",/r/nyc/comments/fcb055/probably_accurate/fj9utjo/
2018-12-08 06:11:35,3801,NYC Officials Ban Unvaccinated Children From Brooklyn Schools,/r/nyc/comments/a4ali7/nyc_officials_ban_unvaccinated_children_from/,2018-12-08 16:33:49,22,"The thing is, anti-vaccination is by and large a liberal movement. And Mississippi and W. Virginia don’t fit that bill. I say this as a card-carrying Democrat myself. If you look at some of the worst counties for vaccination rates in the country, you’ll find places like Marin County, CA. Rich, white, liberal... and anti-science as hell. 


It drives me up a fucking wall that there’s people on my side of the aisle that will cry all day about conservatives being “science deniers” about climate change. But those same people will then turn around and ignore decades of medical science, by using essential oils and forgoing vaccination. It’s insanity.",/r/nyc/comments/a4ali7/nyc_officials_ban_unvaccinated_children_from/ebe0x1u/
2020-06-02 16:32:53,3609,Peaceful protests right now in NYC.,/r/nyc/comments/gvhi1i/peaceful_protests_right_now_in_nyc/,2020-06-02 19:01:16,48,">Occupy was easy to wait out, to many cold days and people lose interest.

Occupy was undermined by two main factors. One, it didn't have an evocative rallying image. Here you have graphic video of a police officer intentionally killing an unresisting arrestee. Occupy had ""evil corporations"" and ""evil corporate acts"" - a lot more abstract, and a lot easier for protest fatigue to set in.

Two, and perhaps most critically, Occupy didn't have a clear goal. It wasn't directed at any particular corporation. It wasn't clear what particular legislation the protesters wanted to see from the government (and which government, federal or state or city?). Many of the protesters didn't even agree with each other on what needed to be done. Yes, they all agreed our existing system needed ""reform,"" but what reform specifically? Some of the Occupy protesters wanted the end of capitalism. Many took aim at the link between our economic system and institutionalized racism. Others prioritized an expansion of the safety net. Still others focused mainly on the need for new environmental regulations to fight climate change.

In contrast, here, the goal is clear: Justice for George Floyd. And, more broadly, police reform and accountability. The asks are focused and the protesters are all in agreement.",/r/nyc/comments/gvhi1i/peaceful_protests_right_now_in_nyc/fsp4bmj/
2020-05-16 20:14:27,3495,Please help support a good cause,/r/nyc/comments/gl7bfa/please_help_support_a_good_cause/,2020-05-17 06:33:43,43,"To add to this, proactive vegetation management (i.e., cutting down hazardous trees before big storms) has been a major climate change resilience approach push by the federal Dept. Of Energy since at least before Sandy. In California, they passed a new law that lets utilities come into your property (not just the right of way) and cut your trees if they threaten a power line.

As a tree lover, I get that it's sad for each tree, but it's very sound policy.",/r/nyc/comments/gl7bfa/please_help_support_a_good_cause/fqwvf9d/
2019-07-05 03:24:50,3471,4th of July Fireworks in NYC as seen from a moving Subway,/r/nyc/comments/c9dy7a/4th_of_july_fireworks_in_nyc_as_seen_from_a/,2019-07-05 08:28:29,6,man i was gonna say nazis and climate change but i guess you got me beat,/r/nyc/comments/c9dy7a/4th_of_july_fireworks_in_nyc_as_seen_from_a/esxyr48/
2016-07-25 15:39:04,3295,My coworker just took this shot from our office balcony.,/r/nyc/comments/4ul345/my_coworker_just_took_this_shot_from_our_office/,2016-07-26 11:30:02,0,Thank you for the actual meteorological data. Personal anecdotes about weather  are inaccurate and the basis for why there are climate change skeptics. ,/r/nyc/comments/4ul345/my_coworker_just_took_this_shot_from_our_office/d5rqcao/
2019-03-06 12:27:27,3088,We really come together when it comes to the NYPD,/r/nyc/comments/ay2sfe/we_really_come_together_when_it_comes_to_the_nypd/,2019-03-07 08:05:01,2,"Do school children/college students get free public transit?  How about the disabled, elderly, low income people?  Maybe we should start there.  

Here's a list of cities around the world with free public transit:

https://en.wikipedia.org/wiki/Free_public_transport

>Public transport isn't a luxury, but it also isn't exactly a given.

That's true, but I was also thinking about using tolls like congestion pricing to fund mass transit.  Make Mass Transit more desirable to get people off the road and reduce emissions/fight climate change. ",/r/nyc/comments/ay2sfe/we_really_come_together_when_it_comes_to_the_nypd/ehzwy01/
2020-03-05 04:55:27,3015,Andrew Yang will run for mayor,/r/nyc/comments/fdu66a/andrew_yang_will_run_for_mayor/,2020-03-05 11:58:23,-1,"Of course there's a political lean. Everyone has one, and it's rooted in our morals. Morals don't have numbers. Republicans deny the facts and numbers on climate change, yet still have a conservative political agenda. Numbers don't prevent this.  If Yang was always guided by mythical all-knowing ""numbers,"" he would have wholeheartedly supported Medicare for All from the beginning. Also, numbers do not always tell a full story and are often open to interpretation. Subjective evaluation can come into play.",/r/nyc/comments/fdu66a/andrew_yang_will_run_for_mayor/fjkvhct/
2020-07-06 08:40:44,2962,I want to say kudos to every single one of you who is wearing masks.,/r/nyc/comments/hm8ul9/i_want_to_say_kudos_to_every_single_one_of_you/,2020-07-06 11:14:53,3,Yea if somethings going to do it it should be the culture of disregarding / doubting science in the face of things like climate change. Now THAT'LL get you to lose faith in humanity 😉,/r/nyc/comments/hm8ul9/i_want_to_say_kudos_to_every_single_one_of_you/fx47raf/
2020-01-10 06:24:34,2957,The MTA will fuckin thanos snap you if you get in the way,/r/nyc/comments/emqv94/the_mta_will_fuckin_thanos_snap_you_if_you_get_in/,2020-01-10 17:54:42,1,">  I feel car ownership shouldn't be completely demonized

I'm sure the survivors in the post-apocalyptic climate change wasteland will understand",/r/nyc/comments/emqv94/the_mta_will_fuckin_thanos_snap_you_if_you_get_in/fdsjw5r/
2020-01-10 06:24:34,2957,The MTA will fuckin thanos snap you if you get in the way,/r/nyc/comments/emqv94/the_mta_will_fuckin_thanos_snap_you_if_you_get_in/,2020-01-10 19:02:33,1,"Thing about it is: you put something in the ballot for me to help the MTA be better? I’ll vote for it. If it’s a small step I can do like the bag fee? Ok, no problem. I get climate change is a big issue but those post apocalyptic road warriors from the future ain’t helping me pay the bills or provide for my family now. A car today is though. Call it selfish but this is NYC and I can honestly say I’m less fuck you got mine than most people but all things considered: if it comes to me and mine today vs the “greater good of tomorrow”. Me and mine win that every time.",/r/nyc/comments/emqv94/the_mta_will_fuckin_thanos_snap_you_if_you_get_in/fdsumrp/
2019-07-24 05:48:02,2954,The unholy trinity of living in NYC,/r/nyc/comments/ch7584/the_unholy_trinity_of_living_in_nyc/,2019-07-24 09:16:43,0,"It doesn't sound like you are using the word libertarian correctly, because I'm not a libertarian at all. I don't think the government is always bad or even mostly bad, and I think certain regulation is absolutely necessary--especially to make sure private companies do not limit competition among other private entities and corruptly take advantage of the market and consumers. What I wrote is monopolies are always inefficient with perverse incentives and are slow to innovate and grow services. They are okay for things like sewer lines and roads that don't require innovation or better and new services. But when the government attempts to run an industry (thus creating a government-run monopoly) it is always, always, less efficient than a competitive industry. That's not an opinion, that's a fact. When you contest basic economics, you sound like trump supporter denying climate change: biased, ignorant, and willing to toss out evidence when it doesn't support your political beliefs.",/r/nyc/comments/ch7584/the_unholy_trinity_of_living_in_nyc/euqmgey/
2020-04-14 09:53:45,2903,Today is the first day New York has reported a net decrease in hospitalizations during COVID19 - an important milestone!,/r/nyc/comments/g18253/today_is_the_first_day_new_york_has_reported_a/,2020-04-15 06:15:44,-1,"> Spoken like a true ladder climber. 

First of all, the fuck’s a ladder climber and how am I like one? 

> I’m a small business owner

I don’t give a shit. 

> I also risk years of work and hundreds of thousands of dollars of investment being endangered

I don’t give a shit if your money is in danger, you decided to take on that risk. You’re an investor, you know there’s no 100% safe investments   

> you want to coddle an entire nation’s economy.

Taking steps to minimize loss of lives (and lets be serious here, the steps the US has taken have not been enough) is not coddling an economy. You want to have your money be coddled and feel safe but the world doesn’t work that way- pandemics happen and if you think shit is bad now, wait until climate change really gets going.",/r/nyc/comments/g18253/today_is_the_first_day_new_york_has_reported_a/fnh2bjs/
2020-08-04 05:39:11,2871,"Hongkongers protest in New York, support the fight for democracy and freedom in Hong Kong",/r/nyc/comments/i3hrn2/hongkongers_protest_in_new_york_support_the_fight/,2020-08-04 15:20:33,4,"US has been in 13 wars/conflicts in the past 30 years that cost us 14+ trillion dollars. Wage levels adjusted for inflation decreased in those 30 years. The wars that the US got involved in put millions of people in poverty. Meanwhile China managed to life hundreds of millions of people out of poverty. You cannot just cherry pick facts. I mean, the US government is censoring covid-19 case data, it lied about the effectiveness of masks to the public at the onset, it pulled out of climate change deals so it can continue to polluting the environment， and it is trying to commit highway robbery by forcing ByteDance to sell tiktok and take the money. Huge racial tension and inequality within the states. I don't feel that the freedom of the government to lie and spread lies is any better than suppression of truth. They are two sides of the same coin. 

Also at this rate, if there is a cold war, the US will probably lose it. Trump is pulling the country out of as many world organizations as he can, leaving China to take over leadership in those organizations. We are world leaders in covid cases and mass shootings. People are actively denying science. When you dent and try to go back on progress, that's when you knoe a country is on the way down.

Harvard actually just published a long term study on satisfaction of the chinese people under the CCP and they actually found most people are satisfied and more happy with the CCP than before. I'm not surprised that's not in the media, whereas a study that found people to be unhappy under the CCP would've been heavily pushed by the media.",/r/nyc/comments/i3hrn2/hongkongers_protest_in_new_york_support_the_fight/g0dldnl/
2019-12-27 14:59:33,2844,Why the subway was delayed at Nevins St today,/r/nyc/comments/eghls8/why_the_subway_was_delayed_at_nevins_st_today/,2020-01-02 13:41:14,1,"I think that this racoon is lost!  I didn't think that they were subway inhabitants...?? I think that he/she should be captured and then released, although release is difficult because in NYC there is lots of competition pretty much everyplace (especially for males.)  It is difficult to establish territory in an unfamiliar place, more in the winter.  If this is a female, she would need to be checked to see if she is nursing; it hasn't been typical for most wildlife to have babies in the winter, but we are seeing this more and more due to climate change.  If she is a nursing female that is tricky.  Do you leave her or take her? 

""You can tell the greatness of a nation and it's moral progress can be judged by the way it's animals are treated.""  Ghandi  (Costa Rica banned all zoos and aquariums in 2017...)

And my favorite (which is really long but really good I think):  

""We need another and a wiser and perhaps a more mystical concept of animals.  Remote from universal nature and living by complicated artifice, man in civilization surveys the creature through the glass of his knowledge and sees thereby a feather magnified and the whole image in distortion.  We patronize them for their incompleteness, for their tragic fate for having taken form so far below ourselves.  And therein do we err.  For the animal shall not be measured by man.  In a world older and more complete than ours, they move finished and complete, gifted with the extension of the senses we have lost or never attained, living by voices we shall never hear.  They are not brethren, they are not underlings; they are other nations, caught with ourselves in the net of life and time, fellow prisoners of the splendor and travail of the earth.""  Henry Beston, The Outermost House",/r/nyc/comments/eghls8/why_the_subway_was_delayed_at_nevins_st_today/fcv9vt9/
2020-08-07 04:57:21,2736,The moment the lights came back on in Manhattan,/r/nyc/comments/i5bqhw/the_moment_the_lights_came_back_on_in_manhattan/,2020-08-07 12:16:55,-6,"This isn't purported to be the end-all, be all solution. If you were as smart as you'd want internet strangers to believe you are you'd realize it's just one thread in the tapestry to combat climate change. But you just wanted to hear yourself type.",/r/nyc/comments/i5bqhw/the_moment_the_lights_came_back_on_in_manhattan/g0pfllo/
2020-05-31 08:17:55,2717,"Cop pulls off protester’s mask , pepper sprays him",/r/nyc/comments/gtzu84/cop_pulls_off_protesters_mask_pepper_sprays_him/,2020-05-31 13:25:33,-1,">You’re a child, you have no idea how the world works

So just because I’m not an adult all my opinions are invalid? Is Greta’s stance on climate change invalid because she’s a minor? Are the teens supporting the riots and protests stupid because they’re teens? Or does “you’re a minor so your opinion is invalid” only count if people disagree with you? 

Also I don’t see how me being a minor automatically makes me a coward",/r/nyc/comments/gtzu84/cop_pulls_off_protesters_mask_pepper_sprays_him/fsg81sr/
2020-07-28 20:25:23,2622,"Hey mods, stop removing every single video of the arrest in Murray Hill. It deserves to be discussed.",/r/nyc/comments/hzsce2/hey_mods_stop_removing_every_single_video_of_the/,2020-07-29 01:52:00,16,R/nyc always goes through phases of right wing troll invasions for a few months before they get bored and die down. I've left for smaller subs multiple times; at various times you couldn't even talk about climate change being real without catching flak.,/r/nyc/comments/hzsce2/hey_mods_stop_removing_every_single_video_of_the/fzlniaq/
2020-09-17 22:35:30,2583,#EverybodyHatesDeBlasio,/r/nyc/comments/iuzi4h/everybodyhatesdeblasio/,2020-09-17 23:35:51,90,"If only energy can be generated from hating de Blasio, we can end climate change",/r/nyc/comments/iuzi4h/everybodyhatesdeblasio/g5ocmdx/
2019-01-20 05:59:57,2515,Meh.,/r/nyc/comments/ahxbqt/meh/,2019-01-20 10:02:25,5,Climate change,/r/nyc/comments/ahxbqt/meh/eejnuzu/
2019-01-20 05:59:57,2515,Meh.,/r/nyc/comments/ahxbqt/meh/,2019-01-20 11:34:54,0,Lord knows I've had better luck being prepared by just opening a window. Weather reports are a sham now that climate change has made things wildly unpredictable,/r/nyc/comments/ahxbqt/meh/eejynos/
2019-02-14 09:46:17,2514,Amazon Pulls Out of Planned New York City Campus,/r/nyc/comments/aqlpt4/amazon_pulls_out_of_planned_new_york_city_campus/,2019-02-14 10:19:43,-2,Trying to reason with them is pretty much the same as arguing against Climate Change deniers or anti vaxers. They pretty much made up their mind regardless of what data you have to back up your argument.,/r/nyc/comments/aqlpt4/amazon_pulls_out_of_planned_new_york_city_campus/eggw7mw/
2018-12-31 06:00:49,2449,We live in a fucking society,/r/nyc/comments/ab6x0e/we_live_in_a_fucking_society/,2018-12-31 12:14:53,12,"I think that applied before the gop became party of Trump. I don’t see myself ever supporting the murder of children at the border, or denying the evidence of climate change. ",/r/nyc/comments/ab6x0e/we_live_in_a_fucking_society/ecyo37z/
2015-03-20 08:53:42,2433,"Oh fuck off, Google. It's gonna snow today.",/r/nyc/comments/2zpdmm/oh_fuck_off_google_its_gonna_snow_today/,2015-03-20 15:10:42,8,"And this just as that article about it being the warmest winter for the northern hemisphere on records shows up. People keep correcting me with ""It's not Global Warming, it's Climate Change"". No, shut up. I've decided it's Global Warming everywhere on earth except the eastern seaboard. Here, it's Climate Change: It doesn't get hotter or colder, it just gets *worse*.",/r/nyc/comments/2zpdmm/oh_fuck_off_google_its_gonna_snow_today/cplezni/
