2015-03-20 08:53:42,2433,"Oh fuck off, Google. It's gonna snow today.",/r/nyc/comments/2zpdmm/oh_fuck_off_google_its_gonna_snow_today/,2015-03-20 10:15:25,47,"NY'kers don't know how lucky they are with this climate change dice.  we get cold and more precip, while the west is hot and bone dry.  on the front page of most west coast newspapers nearly every day is something about their water crisis - so count your blessings  frosty new yorkers, and just pray we don't suffer a major ocean surge bringing storm anytime soon. ",/r/nyc/comments/2zpdmm/oh_fuck_off_google_its_gonna_snow_today/cpl43nh/
2015-03-20 08:53:42,2433,"Oh fuck off, Google. It's gonna snow today.",/r/nyc/comments/2zpdmm/oh_fuck_off_google_its_gonna_snow_today/,2015-03-20 12:15:35,45,"Ew!  Why is their water that unnatural blue color?  Is that because of climate change?

[This is what water should look like.](http://i.imgur.com/MFSGGmC.jpg)",/r/nyc/comments/2zpdmm/oh_fuck_off_google_its_gonna_snow_today/cpl8mgb/
2016-07-16 16:15:05,2401,Vice-presidential nominee Mike Pence samples the best cuisine NYC has to offer.,/r/nyc/comments/4t6rzc/vicepresidential_nominee_mike_pence_samples_the/,2016-07-16 20:41:47,-5,"Native Iowegian, been here less than a year, i think I've eaten at a chain restaurant only for convenience (drive thru).  You'll never see me sitting at a chain restaurant, guaranteed.  But then again, I understand evolution, climate change, and cigarette health risks. ",/r/nyc/comments/4t6rzc/vicepresidential_nominee_mike_pence_samples_the/d5f852y/
2016-07-16 16:15:05,2401,Vice-presidential nominee Mike Pence samples the best cuisine NYC has to offer.,/r/nyc/comments/4t6rzc/vicepresidential_nominee_mike_pence_samples_the/,2016-07-17 07:25:45,3,"Mike pence doesn't think evolution is real, that climate change is real, and doesn't think that cigarettes are a health risk.  Which are all heavily scientifically evidence based facts he just discards, thus him making a shitty decision where to eat would make sense. ",/r/nyc/comments/4t6rzc/vicepresidential_nominee_mike_pence_samples_the/d5fl7ln/
2020-02-04 10:46:32,2385,Cuomo showed up unannounced to an MTA repair site where 130 workers were being paid overtime....and no one was there,/r/nyc/comments/eyttt8/cuomo_showed_up_unannounced_to_an_mta_repair_site/,2020-02-04 11:47:39,-10,"> Mr. Cuomo assumed that climate change and rising water tables were to blame. Not so. The water had nowhere to go because most drains, like the one at 59th Street, were silted shut. The governor called for inspection reports. They falsely showed that drains were open. Of roughly 418 miles of drain pipe, just 17 miles were scheduled for annual cleaning. Even that was not being met. 

This is the greatest description of the Democrat Party I have ever seen",/r/nyc/comments/eyttt8/cuomo_showed_up_unannounced_to_an_mta_repair_site/fgjdzxo/
2018-06-27 05:51:43,2352,"Alexandria Ocasio-Cortez working as a bartender on Nov. 14, 2017, less than a year before she defeated Joseph Crowley in the Democratic primary",/r/nyc/comments/8u8ysk/alexandria_ocasiocortez_working_as_a_bartender_on/,2018-06-28 18:10:41,2,"I don't think that's really an accurate description of my comment. My main point is actually that the current person in that seat supports a many of the same policies (not all but many) that she does (Crowley has previously supported legislation to enact universal healthcare and combat climate change) and would me more effective at getting them implemented because decades of years of policy and leadership experience. I disagree with your premise that the reason these policies haven't been implemented yet is because big money controls the Democratic party. The reason they haven't been implemented is: 1) The right has controlled congress for much of the past 2 decades, 2) Federal policy is extremely complicated to implement. I don't think electing a young person with good values addresses either of those problems.",/r/nyc/comments/8u8ysk/alexandria_ocasiocortez_working_as_a_bartender_on/e1gyo4f/
2020-03-10 07:22:38,2322,"Steer clear from crowded trains they said. Yeah, I don’t think we have time for that.",/r/nyc/comments/fgdqce/steer_clear_from_crowded_trains_they_said_yeah_i/,2020-03-10 12:22:19,10,"At the risk of getting downvoted, I really don’t get the reluctance of New Yorkers to cycle. When the tube was shut down in London for a week loads of people started walking or cycling and loads ended up still doing it after the tube came back on cause they realized it’s pretty easy. Half my friends back in London cycle to work, some over really big distances, much bigger than the average New Yorkers commute is, but I don’t know a single person that cycles to work here. 

I mean I get it to some extent, it does suck cycling here because it feels dangerous and just not set up well for bikes, begging the question of why they don’t do more to facilitate cycling if they’re trying to reduce congestion and combat climate change. But still some people could easily do it, and it’s not like London is set up great for cycling either. Also the weather is way better here. I used to always have to cycle in the rain in London. Flirting with Reddit death here by going against the anti-BdB circle jerk, but he said cycle or walk ‘if you can’, which seems like good advice to be honest",/r/nyc/comments/fgdqce/steer_clear_from_crowded_trains_they_said_yeah_i/fk4oky5/
2020-07-27 06:37:27,2310,NY really made a huge mistake by not legalizing marijuana last year,/r/nyc/comments/hyrgxn/ny_really_made_a_huge_mistake_by_not_legalizing/,2020-07-28 08:48:39,0,"It's really not. Dems have lots of issues and I will fight people who say otherwise but it's not the Dems holding up relief for citizens, it's not the Dems who are shooting teargas at mom's protesting police violence, it's not the Dems who are denying climate change action. The Dems have problems but as it stands the GOP is one massive problem. From education to climate change to healthcare to police reform the GOP is standing firmly against the interest of the average American.",/r/nyc/comments/hyrgxn/ny_really_made_a_huge_mistake_by_not_legalizing/fzimioe/
2019-09-20 11:35:22,2286,Climate Strike NYC,/r/nyc/comments/d6yay1/climate_strike_nyc/,2019-09-20 12:27:20,14,Climate change is real. Don’t confuse weather with climate!,/r/nyc/comments/d6yay1/climate_strike_nyc/f0wc86m/
2019-09-20 11:35:22,2286,Climate Strike NYC,/r/nyc/comments/d6yay1/climate_strike_nyc/,2019-09-20 11:57:59,-37,"Climate change is something we need to act on, but some perspective is necessary. We have already made great strides in reducing our pollution emissions, at least in the West. 

Today, China is the #1 CO2 polluter. 

The US has cleaner skies today than it did 100 years ago.

https://www.futurity.org/birds-feathers-carbon-air-pollution-1570692-2/",/r/nyc/comments/d6yay1/climate_strike_nyc/f0w9p50/
2019-09-20 11:35:22,2286,Climate Strike NYC,/r/nyc/comments/d6yay1/climate_strike_nyc/,2019-09-20 21:24:54,-2,"We're all going to pay more for electricity, and likely more in taxes (federal, state and city) to fight climate change.


That's likely what ""doing something"" will mean to the average American. You might get some money out of the rich, but don't count on it.

edit: I get it. None of you want to hear that.

edit 2: I suspect some of you downvoting are no better than the fossil fuel industry that doesn't want cap and trade programs.",/r/nyc/comments/d6yay1/climate_strike_nyc/f0xl52y/
2019-09-20 11:35:22,2286,Climate Strike NYC,/r/nyc/comments/d6yay1/climate_strike_nyc/,2019-09-20 21:18:03,-5,"Jeez, blocking the street for a protest about something that is impossible to stop is just plain stupid. You can’t stop climate change.",/r/nyc/comments/d6yay1/climate_strike_nyc/f0xkpzl/
2019-09-20 11:35:22,2286,Climate Strike NYC,/r/nyc/comments/d6yay1/climate_strike_nyc/,2019-09-21 04:06:55,-4,I heard that this climate change march was so effective that it made Barack Obama sell his ocean front house.,/r/nyc/comments/d6yay1/climate_strike_nyc/f0y4gf9/
2019-09-20 11:35:22,2286,Climate Strike NYC,/r/nyc/comments/d6yay1/climate_strike_nyc/,2019-09-21 07:53:52,-2,Yet every single hurricane people scream climate change. You're only allowed to confuse them in one direction,/r/nyc/comments/d6yay1/climate_strike_nyc/f0yny69/
2019-09-20 11:35:22,2286,Climate Strike NYC,/r/nyc/comments/d6yay1/climate_strike_nyc/,2019-09-20 17:45:14,8,"I’m curious, have you read/listened to anything about Andrew Yang? I saw his climate change town hall recently, he stands out as the one guy advocating we SHOULD use nuclear, in addition to a host of other power sources, because we’re gonna need everything we have.",/r/nyc/comments/d6yay1/climate_strike_nyc/f0x6g7g/
2019-09-20 11:35:22,2286,Climate Strike NYC,/r/nyc/comments/d6yay1/climate_strike_nyc/,2019-09-20 16:18:17,9,You're right. We just turn on the police. That is the only solution for climate change.,/r/nyc/comments/d6yay1/climate_strike_nyc/f0x03x8/
2019-09-20 11:35:22,2286,Climate Strike NYC,/r/nyc/comments/d6yay1/climate_strike_nyc/,2019-09-20 19:23:13,9,Do you really think they're protesting the weather or are you just pretending to not understand how climate change works?,/r/nyc/comments/d6yay1/climate_strike_nyc/f0xd6z7/
2019-09-20 11:35:22,2286,Climate Strike NYC,/r/nyc/comments/d6yay1/climate_strike_nyc/,2019-09-20 16:15:33,-19,"What do you mean, fascist!!! They are protesting climate change!! You bigot!!!",/r/nyc/comments/d6yay1/climate_strike_nyc/f0wzw7k/
2019-09-20 11:35:22,2286,Climate Strike NYC,/r/nyc/comments/d6yay1/climate_strike_nyc/,2019-09-20 20:43:56,1,"Climate change is a fundamentally  unsolvable issue with current technology, unless most of the decarbonization is the power supply is done with nuclear energy, and this is a problem we must solve ASAP. France's decarbonization of their economy with nuclear power in the 70s and 80s is the only example in history of an advanced economy doing so. Whereas Germany has spent hundreds of billions of euro and drastically increased energy prices with their version of the green new deal, but are burning **more** coal than a decade ago and their emission reductions have been comparable to those of america, which has taken virtually no action.

Math is real, engineering is real, renewables cannot consistently power the majority of a modern grid with present technology.",/r/nyc/comments/d6yay1/climate_strike_nyc/f0xil7l/
2019-09-20 11:35:22,2286,Climate Strike NYC,/r/nyc/comments/d6yay1/climate_strike_nyc/,2019-09-20 15:19:00,-14,"Free housing is clearly the answer

Also, coincidentally, it’s the lifestyles and jobs the Democrat voters have that are going to save us from climate change.",/r/nyc/comments/d6yay1/climate_strike_nyc/f0wukng/
2019-09-20 11:35:22,2286,Climate Strike NYC,/r/nyc/comments/d6yay1/climate_strike_nyc/,2019-09-20 14:04:22,-16,"So it will result in nothing, just like all the other marches in the past 5 years. Hey remember Occupy Wall Street? Without a unified clearly defined goal, it is doomed to fail like the rest. And “Climate change is real and bad” is not a goal",/r/nyc/comments/d6yay1/climate_strike_nyc/f0wm86h/
2019-09-20 11:35:22,2286,Climate Strike NYC,/r/nyc/comments/d6yay1/climate_strike_nyc/,2019-09-20 21:28:51,7,"To piggyback: this protest/strike/march isn’t protesting the concept of climate change. It’s protesting against the blatant corruption and greed that allows (and has allowed) the Earths climate to become utterly fucked, possibly irreversibly. I’d recommend finding videos of some of the speakers from later in the day, if they’re up yet. Two teens from LA and Indianapolis very eloquently described how shitty their politicians are, regarding shilling for coal and oil.",/r/nyc/comments/d6yay1/climate_strike_nyc/f0xlduw/
2019-09-20 11:35:22,2286,Climate Strike NYC,/r/nyc/comments/d6yay1/climate_strike_nyc/,2019-09-20 18:02:50,3,"easy to say that when you aren't directly involved. 9/10 people i know who didn't go to school went to the protests, cmon ""just want to get out of school"" as if climate change isn't something that is going to directly fuck all of us.",/r/nyc/comments/d6yay1/climate_strike_nyc/f0x7oit/
2019-09-20 11:35:22,2286,Climate Strike NYC,/r/nyc/comments/d6yay1/climate_strike_nyc/,2019-09-20 18:10:30,-5,"If all those people stop buying stuff out at least curb what they get, like maybe only getting a new phone every 5 years, buy less clothes, only buy food that was created locally. You know stuff those people could do without trying to force it on the non believers, it will still greatly reduce production.

I'm sorry, everyone should be able to buy new things when they want, they just want those new things to be more expensive so they can think their dollar is fighting climate change. Of course that effects the poor the most, but hey we trendy climate change believers is okay with the poor going without, just so long as we can still get the new iphone.",/r/nyc/comments/d6yay1/climate_strike_nyc/f0x87nu/
2019-09-20 11:35:22,2286,Climate Strike NYC,/r/nyc/comments/d6yay1/climate_strike_nyc/,2019-09-20 18:55:36,1,"No one is against nuclear power here. If it's the way to go then let's go. But criticizing people protesting climate change for not protesting for nuclear power is a very ""if you can't help all, help non"" approach",/r/nyc/comments/d6yay1/climate_strike_nyc/f0xbaab/
2019-09-20 11:35:22,2286,Climate Strike NYC,/r/nyc/comments/d6yay1/climate_strike_nyc/,2019-09-20 14:12:33,13,"When you have a government that thinks climate change is not real enough to be a concern, awareness of public concern is a good goal.",/r/nyc/comments/d6yay1/climate_strike_nyc/f0wn50s/
2019-09-20 11:35:22,2286,Climate Strike NYC,/r/nyc/comments/d6yay1/climate_strike_nyc/,2019-09-20 17:02:08,0,"Good for China, but it's far too little too late. Better than nothing though, of course.

I highly suggest you look into all the feedback loops associated with climate change, and then you may understand this issue is already spiraling out of our control. We need our politicians and CEO's to help stop/reduce emissions immediately, not in 2030 or 2050 or whatever bullshit timeline those fuckers are on.

Edit: Looks like Jeff Bezos is making Amazon meet the goals of the Paris agreement 10 years early. 80% of Amazon’s energy use to come from renewable sources by 2024. If Amazon can do this hopefully others will follow.",/r/nyc/comments/d6yay1/climate_strike_nyc/f0x3dx6/
2019-09-20 11:35:22,2286,Climate Strike NYC,/r/nyc/comments/d6yay1/climate_strike_nyc/,2019-09-20 19:01:55,5,">No one is against nuclear power here.

Wanna bet? I think you've missed a memo or two. 

>But criticizing people protesting climate change for not protesting for nuclear power is a very ""if you can't help all, help non"" approach

I mean, not really, since they're missing the *number one* way to actually do something about it.",/r/nyc/comments/d6yay1/climate_strike_nyc/f0xbpm1/
2019-09-20 11:35:22,2286,Climate Strike NYC,/r/nyc/comments/d6yay1/climate_strike_nyc/,2019-09-20 19:04:41,3,"Ok, I'm sorry I can't talk for everyone. I'm not talking against nuclear power here, I'm talking against people making climate change to be about nuclear power. There're many aspect to climate change like deforestation and pollution caused by industries like plastic production or fashion, too, not just the production of power",/r/nyc/comments/d6yay1/climate_strike_nyc/f0xbw9z/
2019-09-20 11:35:22,2286,Climate Strike NYC,/r/nyc/comments/d6yay1/climate_strike_nyc/,2019-09-21 15:57:29,1,"I don't think so.  I and may others that are in /r/NYC don't live in NYC boroughs.  We live in the suburbs of NYC or used to live in NYC but moved away. I took the day off and traveled by train and subway to the march.

Hipsters are not supid.  They know that advancing hybrids, plugin hybrids and EVs are good for us all since a lot of people will refuse to use public transit since it's inadequate by design in this country.  Better to give car buyers better more efficient vehicle choices over ICE vehicles sooner rather than later.

No, I think it's Reddit conservative extemist groups and corporate bots doing the down-voting to try to suppress the climate change march news.

[edit: I upvoted your posts here]",/r/nyc/comments/d6yay1/climate_strike_nyc/f0zuctt/
2019-09-20 11:35:22,2286,Climate Strike NYC,/r/nyc/comments/d6yay1/climate_strike_nyc/,2019-09-20 18:05:22,-2,"Without commenting on the substance of the link, couldn't they at least proof read it? Sentence 2 has an annoying and avoidable error. All you have to do is run MS Word's spelling/grammar checker. Sure, if you're making a post to Reddit or whatever, who cares. But if you're publishing a set of goals and wish to be taken seriously, you should really proof your stuff.

Anyway, Climate Change is much more important than grammar, and the focus should be on Climate Change, not grammar, so please don't downvote me because you think I'm trying to belittle their cause. I just wish they were more thoughtful about their outward facing communications.",/r/nyc/comments/d6yay1/climate_strike_nyc/f0x7uxl/
2019-09-20 11:35:22,2286,Climate Strike NYC,/r/nyc/comments/d6yay1/climate_strike_nyc/,2019-09-20 18:58:37,2,"Triggering people = good, protesting for wanting measures for climate change = bad.  Got it.",/r/nyc/comments/d6yay1/climate_strike_nyc/f0xbhjc/
2019-09-20 11:35:22,2286,Climate Strike NYC,/r/nyc/comments/d6yay1/climate_strike_nyc/,2019-09-21 08:56:47,0,"That's moot. It's a useless point.

So, you're not saying socialism, you're saying socialism just where YOU want to have socialism.

Financial incentives are ALMOST always the primary driver of innovation. Give examples where they aren't. Capitalism works.

It's working right now to fix climate change.",/r/nyc/comments/d6yay1/climate_strike_nyc/f0yt6wf/
2019-09-20 11:35:22,2286,Climate Strike NYC,/r/nyc/comments/d6yay1/climate_strike_nyc/,2019-09-21 09:06:42,1,"How is it a moot point when you try to argue that financial incentives gave us electric cars and I counter with the fact that unregulated markets and collusion enabled electric cars to be sidelined by corporate interest? Really inconsistent argument there.

And no, I am saying socialism. I’m using the literal definition of the term. Profit motive still can exist in socialist markets. I’m starting to think you don’t really know what it means. 

Capitalism isn’t working to fix climate change. Climate change didn’t just “happen.” Capitalism is a direct and primary cause of climate change. And I’m not going to hold your hand and explain how capitalism is the root of anthropogenic climate change. I really don’t care enough to continue this discussion when you’re just repeating the same points over and over without synthesizing anything new.",/r/nyc/comments/d6yay1/climate_strike_nyc/f0ytyfm/
2019-09-20 11:35:22,2286,Climate Strike NYC,/r/nyc/comments/d6yay1/climate_strike_nyc/,2019-09-21 09:21:49,1,"Because it doesn't apply to current conditions?  I thought that was obvious.

> Critically the exchange value of a commodity ""is independent of the amount of labour required to appropriate its useful qualities"". However, rather depends on the amount of socially necessary labour required to produce it. All commodities are sold at their value, so the origin of the capitalist profit is not in cheating or theft, but in the fact that the cost of reproduction of labour power, or the worker's wage, is less than the value created during their time at work, enabling the capitalists to yield a surplus value or profit on their investments.

Profit is stealing from workers.

Capitalism IS working to fix climate change. Apparently, you just don't know about. Odd for someone with all this experience in environmental matters. Behind on your reading?? Like 50 years behind??

 Here's just a few.
[Research](https://scholar.google.com/scholar?q=Climate+change+research&hl=en&as_sdt=0&as_vis=1&oi=scholart)

[Today!!! in marketplace solutions](https://www.engadget.com/2019/09/19/google-to-invest-record-breaking-amount-in-renewable-energy/?guce_referrer=aHR0cHM6Ly93d3cuaW5vcmVhZGVyLmNvbS8&guce_referrer_sig=AQAAAIt9vpeUr6laY4ol4IGi2KURZpEYgbd75y7sx1A_Xi0cGUVHaiQFRSFRRerl3RhjLWQ-znK3Fh2NmQvqld_Rgum4cmYuHD3NN3vOAfR3Q8_pWIPJEPuf-kxNVHrVx3JUq7HAebya1zLe5eT2jnCc5-QfNHgDNkP0NqRuzj9UybCt&guccounter=2)

[Plus](https://techcrunch.com/2019/09/19/amazon-orders-100k-electric-delivery-trucks-from-rivian-as-part-of-going-carbon-neutral-by-2040/)

Don't be so negative. Things are being done. You're probably too young to see the progress over 50, 40, 30 years, but man, it's huge. And the advance of science keeps getting faster and faster. Within the next 4 years, we will have a cure for cancer. Climate change is easy compared to that.

Wind power in Illinois: https://en.wikipedia.org/wiki/Wind_power_in_Illinois

Illinois closing coal plants: https://news.stlpublicradio.org/post/four-illinois-coal-burning-power-plants-closing

Coal is/was huge in Illinois! And it's dirty coal.

Another one just announced! https://www.chicagotribune.com/news/environment/ct-illinois-coal-plant-closing-20190916-3ql3ch4c3vhmfcnzniot5z2zt4-story.html

Electric car projections: https://evadoption.com/ev-sales/ev-sales-forecasts/ and https://www.cnbc.com/2018/05/30/electric-vehicles-will-grow-from-3-million-to-125-million-by-2030-iea.html

Carbon Sequestration: https://www.climatecentral.org/news/first-commercial-co2-capture-plant-live-21494 and https://en.wikipedia.org/wiki/Carbon_capture_and_storage#Industrial-scale_projects

Convert CO2 to carbon fiber!! https://www.sustainabilitymatters.net.au/content/sustainability/news/algae-used-to-convert-co2-into-carbon-fibres-1472845829",/r/nyc/comments/d6yay1/climate_strike_nyc/f0yv4h8/
2020-05-28 14:30:20,2169,"""No Mask - No Entry""",/r/nyc/comments/gse5iv/no_mask_no_entry/,2020-05-29 08:26:59,1,">It’s because both the WHO and CDC did not recommend it.

That was before asymptomatic and pre-symptomatic transmission was confirmed, IIRC.

>The science is still divided over wearing face masks.  So saying we “knew they worked” isn’t the entire story.

After reading that article, it seems it’s not “divided” so much as “unknown how much benefit there is” to make a recommendation. Even one of the critical scientists made it a point he’s not saying masks are not beneficial. This is the danger with reporting these days, presenting issues as 50/50, like climate change, providing both sides of the argument as if they are balanced, when in reality it’s 97/3 that there is a problem with climate change.

For masks, it’s one of those things where there is basically no downside, and all upside. So the current policy of wear a freaking mask when in situations where you will be near other people outside your home is a no-brainer.",/r/nyc/comments/gse5iv/no_mask_no_entry/fs7b7rn/
2020-09-25 09:37:49,2163,Outdoor dining now permanent and year-round in New York City,/r/nyc/comments/izlpko/outdoor_dining_now_permanent_and_yearround_in_new/,2020-09-25 13:39:04,-2,Outdoor heater lamps are a huge energy consumer.  I guess caring about climate change goes out the window whenever DeBlasio feels like it.,/r/nyc/comments/izlpko/outdoor_dining_now_permanent_and_yearround_in_new/g6kdr6g/
2020-09-25 09:37:49,2163,Outdoor dining now permanent and year-round in New York City,/r/nyc/comments/izlpko/outdoor_dining_now_permanent_and_yearround_in_new/,2020-09-25 11:42:36,16,"I know I live here but in the grand scheme recent winters have been very mild. Again, they will need heaters. If a high is 45 around 7PM it’ll most likely be 39ish. And being subtropical that’s not just an opinionated statement. It’s officially classified as a subtropical region now. https://www.nytimes.com/2020/07/24/nyregion/climate-change-nyc.html

There are plant species native from New England that are dying out here and plant species from Georgia that have been spotted growing here way better. Some subtropical plants that couldn’t grow past a shrub are growing several feet high. Climate change is real.",/r/nyc/comments/izlpko/outdoor_dining_now_permanent_and_yearround_in_new/g6k08vq/
2020-09-25 09:37:49,2163,Outdoor dining now permanent and year-round in New York City,/r/nyc/comments/izlpko/outdoor_dining_now_permanent_and_yearround_in_new/,2020-09-25 12:22:57,6,"A ""couple"" means two, genius.  Not three.  Climate change is real.  It also doesn't mean that every day is going to be over 45 degrees in the winter.  It still gets cold here even though it hasn't snowed as much the last two years.

And I said it was below 20 for a couple weeks straight two years ago, which it was at night.  And the high for those two weeks was mostly in the 20's, with a few days going into the mid 30's.",/r/nyc/comments/izlpko/outdoor_dining_now_permanent_and_yearround_in_new/g6k4zcj/
